{
  "manifest_version": "1.0.0-dev",
  "plugin_id": "com.acme.workspace",
  "version": "1.2.0",
  "display": {
    "name": {
      "en-US": "Workspace Tools",
      "zh-CN": "工作区工具"
    },
    "description": {
      "en-US": "Open and manage local workspaces.",
      "zh-CN": "打开和管理本地工作区。"
    },
    "icon": {
      "kind": "asset",
      "path": "assets/plugin-icon.svg"
    }
  },
  "publisher": {
    "author": "Acme",
    "homepage": "https://example.com/workspace-tools",
    "repository": "https://github.com/acme/workspace-tools"
  },
  "compatibility": {
    "lensx": {
      "min_version": "0.1.0",
      "max_version_exclusive": "0.2.0"
    },
    "host_api": {
      "min_version": "1.0.0-dev",
      "max_version_exclusive": "2.0.0"
    }
  },
  "runtime": {
    "kind": "iframe",
    "entry": "dist/plugin.html"
  },
  "requested_permissions": [
    {
      "permission_id": "lensx.filesystem.read_selected",
      "reason": {
        "en-US": "Read folders selected by the user.",
        "zh-CN": "读取用户主动选择的目录。"
      }
    }
  ],
  "contributes": {
    "pages": [
      {
        "id": "home",
        "title": {
          "en-US": "Workspace Tools",
          "zh-CN": "工作区工具"
        },
        "route": "/",
        "icon": {
          "kind": "asset",
          "path": "assets/home.svg"
        },
        "required_permissions": []
      },
      {
        "id": "open_project",
        "title": {
          "en-US": "Open Project",
          "zh-CN": "打开项目"
        },
        "route": "/open-project",
        "parent_page_id": "home",
        "required_permissions": ["lensx.filesystem.read_selected"]
      }
    ],
    "actions": [
      {
        "id": "open_project",
        "title": {
          "en-US": "Open Project",
          "zh-CN": "打开项目"
        },
        "description": {
          "en-US": "Open the project selection page.",
          "zh-CN": "打开项目选择页面。"
        },
        "default_keywords": {
          "en-US": ["open workspace", "open folder"],
          "zh-CN": ["打开工作区", "打开文件夹"]
        },
        "target": {
          "kind": "page",
          "page_id": "open_project"
        }
      }
    ],
    "launcher": {
      "default_action_id": "open_project"
    }
  }
}
